{"$id":"urn:otqa:v2:config","$schema":"https://json-schema.org/draft/2020-12/schema","additionalProperties":false,"properties":{"algorithm":{"$ref":"urn:otqa:v2:common#/$defs/AlgorithmPolicy"},"budget":{"$ref":"urn:otqa:v2:common#/$defs/QueryBudget"},"configuration_id":{"pattern":"^[A-Za-z0-9][A-Za-z0-9._-]{0,127}$","type":"string"},"execution":{"$ref":"urn:otqa:v2:common#/$defs/ExecutionOptions"},"recording":{"$ref":"urn:otqa:v2:common#/$defs/RecordingOptions"},"schema_version":{"const":2}},"required":["schema_version","configuration_id","algorithm","budget","execution","recording"],"type":"object"}
