{"algorithm":{"depth":2,"grid_size":10,"higher_depth_query_source":"both","horizon_execution":"receding","min_expected_progress":0.001,"planning_evaluation":"candidate_count","query_strategy":"reduction_per_query","stopping":{"rule":"single_candidate"}},"budget":{"max_queries":null},"configuration_id":"adaptive2-grid10-progress001","execution":{"cache_policy_id":"bounded_v1","case_timeout_seconds":null,"native_threads":1,"start_method":"forkserver","workers":8},"recording":{"durability":"per_answer","profile":false,"telemetry_failure_policy":"continue","trace_level":"standard"},"schema_version":2}
